{
  "schema_version": "session.v1",
  "session_id": "8d1e4f7a-2b3c-4d5e-8f90-a1b2c3d4e5f6",
  "started_at": "2026-09-10T14:02:00-05:00",
  "duration_ms": 720000,
  "remote_tool": { "kind": "screenconnect", "client_version": "24.1.3" },
  "partial_capture": false,
  "frames_purged_unredacted": 0,
  "local_only": false,
  "policy_version": "v14",
  "events": [
    { "type": "focus", "ts_ms": 0, "process": "ScreenConnect.WindowsClient", "scope": "remote_tool" },
    { "type": "capture_state", "ts_ms": 0, "state": "recording" },
    { "type": "click", "ts_ms": 62000, "x": 812, "y": 440, "button": "left", "frame_id": "f-0002" },
    { "type": "click", "ts_ms": 130000, "x": 640, "y": 512, "button": "left", "frame_id": "f-0003" },
    { "type": "shortcut", "ts_ms": 150000 },
    { "type": "typing_burst", "ts_ms": 205000, "char_count": 9 },
    { "type": "enter", "ts_ms": 208000 },
    { "type": "capture_state", "ts_ms": 252000, "state": "suppressed", "reason": "password_field" },
    { "type": "capture_state", "ts_ms": 280000, "state": "recording" },
    { "type": "marker", "ts_ms": 330000, "frame_id": "f-0005" },
    { "type": "focus", "ts_ms": 500000, "process": "OUTLOOK", "scope": "out_of_scope" },
    { "type": "click", "ts_ms": 505000, "x": 300, "y": 200, "button": "left" },
    { "type": "focus", "ts_ms": 545000, "process": "ScreenConnect.WindowsClient", "scope": "remote_tool" },
    { "type": "narration", "ts_ms": 610000, "segment_id": "s-0005" }
  ],
  "frames": [
    {
      "id": "f-0002",
      "ts_ms": 62100,
      "trigger": "click",
      "image": "frames/f-0002.jpg",
      "width": 1600,
      "height": 900,
      "cursor": { "x": 760, "y": 412 },
      "redaction_pending": false,
      "redacted_at": "2026-09-10T14:03:03-05:00",
      "masked_regions": [],
      "sensitive_context": false,
      "ocr_text": "Print Spooler Properties (Local Computer)\nService status: Stopped",
      "excluded_by_user": false
    },
    {
      "id": "f-0003",
      "ts_ms": 130200,
      "trigger": "click",
      "image": "frames/f-0003.jpg",
      "width": 1600,
      "height": 900,
      "cursor": { "x": 598, "y": 480 },
      "redaction_pending": false,
      "redacted_at": "2026-09-10T14:04:11-05:00",
      "masked_regions": [{ "x": 1020, "y": 610, "width": 220, "height": 28, "kind": "card" }],
      "sensitive_context": false,
      "ocr_text": "Service status: Running\nBilling card on file: [CARD]",
      "excluded_by_user": false
    },
    {
      "id": "f-0004",
      "ts_ms": 176000,
      "trigger": "scene_change",
      "image": "frames/f-0004.jpg",
      "width": 1600,
      "height": 900,
      "redaction_pending": false,
      "redacted_at": "2026-09-10T14:04:57-05:00",
      "masked_regions": [],
      "sensitive_context": false,
      "ocr_text": "Inbox - Outlook",
      "excluded_by_user": true
    },
    {
      "id": "f-0005",
      "ts_ms": 330050,
      "trigger": "marker",
      "image": "frames/f-0005.jpg",
      "width": 1600,
      "height": 900,
      "redaction_pending": false,
      "redacted_at": "2026-09-10T14:07:31-05:00",
      "masked_regions": [],
      "sensitive_context": false,
      "ocr_text": "Printer queue: 0 documents",
      "excluded_by_user": false
    }
  ],
  "transcript": [
    { "id": "s-0001", "ts_ms": 58000, "end_ms": 61500, "speaker": "tech", "text": "ok the printer's showing offline, let me check the spooler", "frame_id": "f-0002", "confidence": 0.93 },
    { "id": "s-0002", "ts_ms": 126000, "end_ms": 129000, "speaker": "tech", "text": "spooler's stopped, restarting it", "frame_id": "f-0003", "confidence": 0.9 },
    { "id": "s-0003", "ts_ms": 262000, "end_ms": 265000, "speaker": "tech", "text": "the admin password is [REDACTED]", "confidence": 0.88 },
    { "id": "s-0004", "ts_ms": 325000, "end_ms": 329000, "speaker": "tech", "text": "clearing the queue now", "frame_id": "f-0005", "confidence": 0.95 },
    { "id": "s-0005", "ts_ms": 610000, "end_ms": 614000, "speaker": "tech", "text": "test page came out, she says it's fine", "confidence": 0.91 }
  ],
  "draft": {
    "problem": "Front-desk printer at Acme Dental showed \"Offline\" and print jobs were stuck in the queue.",
    "steps": [
      { "text": "Checked the Print Spooler service; it was stopped.", "confidence": "high", "frame_refs": ["f-0002"], "transcript_refs": ["s-0001"] },
      { "text": "Restarted the Print Spooler service.", "confidence": "low", "frame_refs": ["f-0003"] },
      { "text": "Cleared the print queue.", "confidence": "high", "frame_refs": ["f-0005"], "transcript_refs": ["s-0004"] },
      { "text": "Printed a test page; the user confirmed it came out.", "confidence": "high", "frame_refs": [], "transcript_refs": ["s-0005"] }
    ],
    "result": "Printer back online and printing. User confirmed.",
    "follow_ups": ["If the spooler stops again this week, update the HP Universal driver."],
    "suggested_title": "Printer offline",
    "suggested_time_minutes": 30,
    "kb_candidate": false,
    "kb_reason": "Not a KB candidate: one-off fix on one printer",
    "source": "cloud",
    "prompt_version": "note_v1"
  }
}
