{
  "schema_version": "session.v1",
  "session_id": "3f6c2b1e-4a7d-4c1e-9b2a-1c5d8e7f6a90",
  "started_at": "2026-09-10T14:02:00-05:00",
  "remote_tool": { "kind": "screenconnect", "client_version": "24.1.3" },
  "partial_capture": false,
  "frames_purged_unredacted": 0,
  "local_only": false,
  "events": [
    { "type": "click", "ts_ms": 1200, "x": 812, "y": 440, "button": "left", "frame_id": "f-0001" },
    { "type": "typing_burst", "ts_ms": 3400, "char_count": 12 }
  ],
  "frames": [
    {
      "id": "f-0001",
      "ts_ms": 1210,
      "trigger": "click",
      "image": "frames/f-0001.jpg",
      "width": 1600,
      "height": 900,
      "cursor": { "x": 760, "y": 412 },
      "redaction_pending": true,
      "masked_regions": [],
      "sensitive_context": false,
      "excluded_by_user": false
    }
  ],
  "transcript": []
}
